[
  {"schemaVersion":"0.1.0","id":"ev-1","type":"work.claimed","occurredAt":"2026-08-19T00:20:00Z","projectId":"BYJTT-LAB-001","workUnitId":"WU-001","stageId":"implement","actor":{"kind":"agent","id":"worker-a","role":"Gameplay Implementation"},"repositoryRevision":"b204e04062f88a1a4a077774ac378f7fbbb4d1a0","evidenceIds":[],"correlationId":"corr-wu-001","causationId":null,"idempotencyKey":"claim-wu-001-a","payload":{"leaseId":"lease-wu-001-a"}},
  {"schemaVersion":"0.1.0","id":"ev-2","type":"implementation.changed","occurredAt":"2026-08-19T00:35:00Z","projectId":"BYJTT-LAB-001","workUnitId":"WU-001","stageId":"implement","actor":{"kind":"agent","id":"worker-a","role":"Gameplay Implementation"},"repositoryRevision":"candidate-r1","evidenceIds":["build-1"],"correlationId":"corr-wu-001","causationId":"ev-1","idempotencyKey":"impl-wu-001-r1","payload":{}},
  {"schemaVersion":"0.1.0","id":"ev-3","type":"qa.failed","occurredAt":"2026-08-19T00:40:00Z","projectId":"BYJTT-LAB-001","workUnitId":"WU-001","stageId":"automated-qa","actor":{"kind":"agent","id":"qa-worker","role":"QA Critic"},"repositoryRevision":"candidate-r1","evidenceIds":["qa-fail-1"],"correlationId":"corr-wu-001","causationId":"ev-2","idempotencyKey":"qa-wu-001-r1","payload":{}},
  {"schemaVersion":"0.1.0","id":"ev-4","type":"recovery.attempted","occurredAt":"2026-08-19T00:45:00Z","projectId":"BYJTT-LAB-001","workUnitId":"WU-001","stageId":"automated-qa","actor":{"kind":"agent","id":"worker-a","role":"Gameplay Implementation"},"repositoryRevision":"candidate-r2","evidenceIds":["recovery-1"],"correlationId":"corr-wu-001","causationId":"ev-3","idempotencyKey":"recovery-wu-001-1","payload":{}},
  {"schemaVersion":"0.1.0","id":"ev-5","type":"qa.passed","occurredAt":"2026-08-19T00:50:00Z","projectId":"BYJTT-LAB-001","workUnitId":"WU-001","stageId":"automated-qa","actor":{"kind":"agent","id":"qa-worker","role":"QA Critic"},"repositoryRevision":"candidate-r2","evidenceIds":["qa-pass-1"],"correlationId":"corr-wu-001","causationId":"ev-4","idempotencyKey":"qa-wu-001-r2","payload":{}},
  {"schemaVersion":"0.1.0","id":"ev-6","type":"human.verdict","occurredAt":"2026-08-19T00:55:00Z","projectId":"BYJTT-LAB-001","workUnitId":"WU-001","stageId":"human-playtest","actor":{"kind":"human","id":"jordan","role":null},"repositoryRevision":"candidate-r2","evidenceIds":["playtest-1"],"correlationId":"corr-wu-001","causationId":"ev-5","idempotencyKey":"verdict-wu-001-r2","payload":{"decision":"approved"}},
  {"schemaVersion":"0.1.0","id":"ev-7","type":"work.released","occurredAt":"2026-08-19T00:56:00Z","projectId":"BYJTT-LAB-001","workUnitId":"WU-001","stageId":"human-playtest","actor":{"kind":"agent","id":"worker-a","role":"Gameplay Implementation"},"repositoryRevision":"candidate-r2","evidenceIds":["qa-pass-1","playtest-1"],"correlationId":"corr-wu-001","causationId":"ev-6","idempotencyKey":"release-wu-001-a","payload":{"leaseId":"lease-wu-001-a"}}
]
